{
  "schema_version": "1.0",
  "artifact_kind": "openfga-model",
  "artifact_content_digest": "sha256:34d59b2230ea944ae1c2a1d9d27dc36baf3ee90f5514600cd007b215b7e642df",
  "source": {
    "kind": "openfga-server",
    "canonical_source_ref": "openfga://platform-test/authorization-models/01KVXG15ETYAHMHANFD0E5CVK8"
  },
  "runtime_selector": {
    "selector_kind": "vault",
    "vault_path": "kv/platform/openfga",
    "field": "model_id"
  },
  "promotion": {
    "test": {
      "status": "verified",
      "method": "pr-promotion",
      "store_ref": "platform-test",
      "verified_at": "2026-06-24T19:01:50Z",
      "promoted_at": null,
      "verified_by_pr": null,
      "promoted_by_pr": null,
      "model_id_env": "01KVXG15ETYAHMHANFD0E5CVK8",
      "evidence": {
        "required_types_present": [
          "user",
          "organization",
          "company",
          "project",
          "warehouse",
          "branch",
          "module",
          "action",
          "report",
          "report_group",
          "subscriber",
          "service_account",
          "notification_topic",
          "notification_template",
          "template",
          "meeting",
          "transcript"
        ],
        "type_count": 17,
        "tuple_backfill_count": 0,
        "list_objects_count": null,
        "allow_proof": {
          "user": "user:1",
          "relation": "can_view",
          "object": "module:MEETING",
          "expected": "allow"
        },
        "deny_proof": {
          "user": "user:0",
          "relation": "can_view",
          "object": "module:MEETING",
          "expected": "deny"
        }
      },
      "evidence_completeness": "complete",
      "source_docs": [
        "Halildeu/platform-backend#742",
        "docs/faz-24-evidence/2026-06-24-openfga-meeting-transcript-object-model.md",
        "docs/runbooks/RB-faz24-openfga-meeting-transcript-object-model.md",
        "Halildeu/platform-k8s-gitops#1660"
      ]
    },
    "prod": {
      "status": "pending",
      "method": "manual-prod-migration",
      "store_ref": "platform-prod",
      "verified_at": null,
      "promoted_at": null,
      "verified_by_pr": null,
      "promoted_by_pr": null,
      "model_id_env": null,
      "evidence": null,
      "evidence_completeness": "unverified",
      "source_docs": [
        "Halildeu/platform-backend#742",
        "docs/runbooks/RB-faz24-openfga-meeting-transcript-object-model.md",
        "Halildeu/platform-k8s-gitops#1660"
      ]
    }
  },
  "metadata": {
    "previous_artifact_content_digest": "sha256:a48a49198c70bd3f928bbac2b87ef3fd83903f00691996c04778f892146f0f9c",
    "rollback_safe": true,
    "rollback_runbook_ref": "docs/runbooks/RB-faz24-openfga-meeting-transcript-object-model.md#rollback",
    "backward_compatible_until": null,
    "migration_refs": [
      "Halildeu/platform-backend#742",
      "Halildeu/platform-k8s-gitops#1660",
      "docs/faz-24-evidence/2026-06-24-openfga-meeting-transcript-object-model.md"
    ]
  },
  "audit": {
    "implementer": "Codex",
    "reviewer": "Claude CLI AGREE 2026-06-24",
    "codex_thread_id": null,
    "created_at": "2026-06-24T19:01:50Z",
    "approval_pathway": "cross-ai-agree"
  }
}
