{
  "schema_version": "1.0",
  "artifact_kind": "openfga-model",
  "artifact_content_digest": "sha256:711364fb006ac49b630a5df6f5724516fe82086c2418a26aa9e1f829e97d6c33",
  "source": {
    "kind": "openfga-server",
    "canonical_source_ref": "openfga://platform-test/authorization-models/01KXYKECVDKPK3B45A8RNXKS4X"
  },
  "runtime_selector": {
    "selector_kind": "kubernetes-configmap",
    "namespace": "platform-test",
    "name": "ethics-service-config",
    "store_id_field": "ERP_OPENFGA_STORE_ID",
    "model_id_field": "ERP_OPENFGA_MODEL_ID",
    "binding": "kustomize/base/apps/etik-speak/ethics-service-deployment.yaml"
  },
  "promotion": {
    "test": {
      "status": "verified",
      "method": "pr-promotion",
      "store_ref": "platform-test/etik-speak",
      "verified_at": "2026-07-20T02:18:48Z",
      "promoted_at": null,
      "verified_by_pr": null,
      "promoted_by_pr": null,
      "model_id_env": "01KXYKECVDKPK3B45A8RNXKS4X",
      "evidence": {
        "required_types_present": [
          "user",
          "team",
          "ethics_product",
          "ethics_case"
        ],
        "type_count": 4,
        "tuple_backfill_count": 4,
        "list_objects_count": null,
        "allow_proof": {
          "user": "user:f8a3b6f6-a984-49d1-b666-c535b11c742f",
          "relation": "case_handler",
          "object": "ethics_product:00000000-0000-0000-0000-000000000001",
          "expected": "allow"
        },
        "deny_proof": {
          "user": "user:9204d823-0f26-436e-9ffe-5f53868f29cb",
          "relation": "case_handler",
          "object": "ethics_product:00000000-0000-0000-0000-000000000001",
          "expected": "deny"
        }
      },
      "evidence_completeness": "complete",
      "source_docs": [
        "runtime-artifacts/faz35-etik-speak/authorization-model-v1.fga",
        "bootstrap/openfga/faz35-etik-speak/authorization-model-v1.json",
        "docs/contracts/faz35-etik-speak-api-mfe-v1.md",
        "Halildeu/platform-k8s-gitops#2656"
      ]
    },
    "prod": {
      "status": "pending",
      "method": "manual-prod-migration",
      "store_ref": "platform-prod/etik-speak",
      "verified_at": null,
      "promoted_at": null,
      "verified_by_pr": null,
      "promoted_by_pr": null,
      "model_id_env": null,
      "evidence": null,
      "evidence_completeness": "unverified",
      "source_docs": [
        "runtime-artifacts/faz35-etik-speak/authorization-model-v1.fga",
        "bootstrap/openfga/faz35-etik-speak/authorization-model-v1.json",
        "docs/adr/0046-faz35-etik-speak-product-cell-topology.md",
        "Halildeu/platform-k8s-gitops#2656"
      ]
    }
  },
  "metadata": {
    "previous_artifact_content_digest": null,
    "rollback_safe": true,
    "rollback_runbook_ref": "docs/adr/0046-faz35-etik-speak-product-cell-topology.md#deployment-and-rollback-gates",
    "backward_compatible_until": null,
    "migration_refs": [
      "Halildeu/platform-k8s-gitops#2656"
    ]
  },
  "audit": {
    "implementer": "Codex",
    "reviewer": "Direct OpenAI Codex gpt-5.6-sol xhigh AGREE; session 019f7d47-43f5-7d73-a3cd-aafa2367d9cd; exact head 322d4950fd85604da3d9af2139c766e43b0bf678",
    "codex_thread_id": "019f766f-10ca-7d11-8234-aad6eaf62a96",
    "created_at": "2026-07-19T00:13:12Z",
    "approval_pathway": "owner-approved"
  }
}
