{
  "schema_version": "1.0",
  "artifact_kind": "openfga-model",
  "artifact_content_digest": "sha256:213397978be773b5b90b83907881a4818439762b0f451476a7d108131e72b66f",
  "source": {
    "kind": "openfga-server",
    "canonical_source_ref": "openfga://pending/platform-test/etik-speak/authorization-model-v1"
  },
  "runtime_selector": {
    "selector_kind": "vault",
    "vault_path": "kv/platform/etik-speak",
    "field": "ERP_OPENFGA_MODEL_ID"
  },
  "promotion": {
    "test": {
      "status": "pending",
      "method": "pr-promotion",
      "store_ref": "platform-test/etik-speak",
      "verified_at": null,
      "promoted_at": null,
      "verified_by_pr": null,
      "promoted_by_pr": null,
      "model_id_env": null,
      "evidence": null,
      "evidence_completeness": "unverified",
      "source_docs": [
        "runtime-artifacts/faz35-etik-speak/authorization-model-v1.fga",
        "docs/contracts/faz35-etik-speak-api-mfe-v1.md",
        "Halildeu/platform-k8s-gitops#2656"
      ]
    },
    "prod": {
      "status": "pending",
      "method": "manual-prod-migration",
      "store_ref": "platform-prod/etik-speak",
      "verified_at": null,
      "promoted_at": null,
      "verified_by_pr": null,
      "promoted_by_pr": null,
      "model_id_env": null,
      "evidence": null,
      "evidence_completeness": "unverified",
      "source_docs": [
        "runtime-artifacts/faz35-etik-speak/authorization-model-v1.fga",
        "docs/adr/0046-faz35-etik-speak-product-cell-topology.md",
        "Halildeu/platform-k8s-gitops#2656"
      ]
    }
  },
  "metadata": {
    "previous_artifact_content_digest": null,
    "rollback_safe": true,
    "rollback_runbook_ref": "docs/adr/0046-faz35-etik-speak-product-cell-topology.md#deployment-and-rollback-gates",
    "backward_compatible_until": null,
    "migration_refs": [
      "Halildeu/platform-k8s-gitops#2656"
    ]
  },
  "audit": {
    "implementer": "Codex",
    "reviewer": "OpenAI Codex gpt-5.6-sol REVISE absorbed; Claude tracked_pending",
    "codex_thread_id": "019f766f-10ca-7d11-8234-aad6eaf62a96",
    "created_at": "2026-07-19T00:13:12Z",
    "approval_pathway": "owner-approved"
  }
}
